{"$schema":"http://json-schema.org/draft-07/schema#","additionalProperties":true,"description":"The HACP/2.0 wire unit (§5.2).\u000a\u000a`extra` carries every field this build does not know, so re-serialization preserves them — the forward-compatibility rule, mechanically enforced.","properties":{"body":{"additionalProperties":true,"description":"Kind-specific body; must be canonicalizable (integers only, §5.1).","type":"object"},"from":{"description":"Author: an agent URN, and a participant of the session (enforced by the session engine, not the shape).","type":"string"},"in_reply_to":{"description":"The message being answered, when this message is an answer.\u000a\u000aFinding V8 (item 3 of 4): always serialized, even as explicit `null`. The schema (`spec/schemas/envelope.json`) types this field `[\"string\",\"null\"]`, so an envelope received with `\"in_reply_to\": null` distinguishes \"explicitly not a reply\" from \"field absent\" — the wire actually carries that null. Skipping the field on serialization when `None` (the pre-fix behaviour) collapsed both cases into \"absent\", so a received envelope with an explicit null did not round-trip byte-for-byte.","type":["string","null"]},"kind":{"description":"Registry string; unknown kinds are valid on receipt (§5.3).","type":"string"},"message_id":{"description":"`\"m-\"` + ≥12 lowercase hex, unique per message.","type":"string"},"protocol":{"description":"`\"HACP/2.0\"`.","type":"string"},"session_id":{"description":"The session this message belongs to (§6). On `session.open` it names the prospective session.","type":"string"},"timestamp":{"description":"Canonical timestamp: `YYYY-MM-DDTHH:MM:SSZ` (§5.1).","type":"string"},"to":{"description":"Addressee: an agent URN.","type":"string"}},"required":["body","from","kind","message_id","protocol","session_id","timestamp","to"],"title":"Envelope","type":"object"}
