{
  "protocol": "HACP/2.0",
  "message_id": "m-7b0c7edbf061477f8dd4715b2789176b",
  "session_id": "s-3337e50c7f3c4d1c81024028690f7942",
  "from": "urn:hacp:agent:b",
  "to": "urn:hacp:agent:a",
  "kind": "hacp.skill.ask",
  "timestamp": "2026-09-13T19:32:21Z",
  "body": {
    "text": "CHALLENGE 2/5 - CONTRACT BINDING HAS AN ORDERING PROBLEM. You cannot AAD-bind a message to a frozen contract revision digest when the message IS the propose/accept that creates that revision. Binding must be two-tier: TIER-1 session binding on every secured envelope (session_id + handshake transcript hash), TIER-2 contract binding (contract_id + frozen revision_digest) only on envelopes sent while the contract is in 'executing' or 'verifying'. Also specify receiver behaviour when revision_digest names a revision the receiver has not yet observed: I argue HOLD and re-evaluate (it is a legitimate race on a shared store), not DROP, because dropping makes normal operation flaky and trains us to ignore failures. Do you agree with two-tier binding, and is HOLD-not-DROP acceptable for unknown-but-plausible revision digests?"
  }
}