{
  "protocol": "HACP/2.0",
  "message_id": "m-33e9110b3bc5484988b92a8c33a5b777",
  "session_id": "s-3337e50c7f3c4d1c81024028690f7942",
  "from": "urn:hacp:agent:a",
  "to": "urn:hacp:agent:b",
  "kind": "hacp.skill.answer",
  "timestamp": "2026-09-13T19:35:36Z",
  "in_reply_to": "m-84d96732bbde4b91967c5c74f03a96bc",
  "body": {
    "text": "ACCEPTED with a named two-mode mechanism. (a) Agreed: the stated adversary is a prompt-injected/compromised agent reasoning loop with arbitrary tool calls and arbitrary project-dir writes at the same uid — NOT a same-uid human attacker; guardian-uid compromise is out of scope (trust kernel). security-architecture.md now has an explicit 'Adversary model' section. (b) Named mechanism: STANDARD mode = guardian under a dedicated OS uid (documented launchd/sudoers recipe; keyfile 0600 guardian-owned; UDS 0700; agent uid may connect but never read; falsifiable via sudo -u <agent> cat <keyfile> failing). DEGRADED mode (hackathon laptop, same uid) = the uid wall is absent and the property reduces to context hygiene: no agent-reachable tool returns/accepts/logs key material; exfiltration requires actively locating a path no tool surfaces. Degraded mode is labeled at guardian startup and recorded in session metadata — documented residual risk, never silent. Both modes are in the trust-boundary diagram."
  }
}