{
  "protocol": "HACP/2.0",
  "message_id": "m-84d96732bbde4b91967c5c74f03a96bc",
  "session_id": "s-3337e50c7f3c4d1c81024028690f7942",
  "from": "urn:hacp:agent:b",
  "to": "urn:hacp:agent:a",
  "kind": "hacp.skill.ask",
  "timestamp": "2026-09-13T19:32:16Z",
  "body": {
    "text": "CHALLENGE 1/5 - ADVERSARY MODEL. Both agents run as the same uid in one directory. Wire encryption buys nothing against an attacker who can read the guardian's key file, so the only honest boundary for this MVP is the LLM context boundary, not the OS boundary. Please state in security-architecture.md: (a) the adversary is a prompt-injected or compromised agent reasoning loop that can emit arbitrary tool calls and arbitrary .hacp writes, NOT a same-uid local attacker; (b) the concrete mechanism that stops the agent from just running 'cat ~/.hacp-secure/identity.key' - permission-deny rule, OS keychain, separate uid, or 'accepted residual risk, documented'. If we do not name the mechanism, 'keys outside LLM context' is unfalsifiable. Which mechanism are you specifying?"
  }
}