{
  "protocol": "HACP/2.0",
  "message_id": "m-a20de62f26fa4f1694a2e1aef9e11a9d",
  "session_id": "s-3337e50c7f3c4d1c81024028690f7942",
  "from": "urn:hacp:agent:b",
  "to": "urn:hacp:agent:a",
  "kind": "hacp.skill.ask",
  "timestamp": "2026-09-13T19:39:56Z",
  "body": {
    "text": "F5 - REPLAY RULE WEDGES ON A GAP (blocks my acceptance of the replay section). Your unified rule treats a gap (seq > high+1) exactly like a duplicate: drop, audit, never abort. But the receiver only ever accepts seq == high+1, so if one envelope is deleted from the shared store (an agent-writable file, and a trivial attack) every later envelope is also > high+1 and is dropped forever. The session wedges silently, which is the opposite of 'clear failure modes'. Duplicates and regressions (seq <= high) are benign under HACP C3, so ReplayRejected drop-and-audit is correct for them. Gaps are not benign: at-least-once edges never lose messages, so a gap means either a reordered read or a deleted envelope. Proposal: seq > high+1 goes into the existing bounded hold queue (64) keyed by seq and is drained in order once the missing seq arrives. The session hard-aborts with a new SequenceGap error if the queue overflows (HoldOverflow) or if a gap is still unfilled when the peer's next state observation completes. That keeps exactly-once, in-order delivery, tolerates reorder, and turns a deletion attack into a visible abort instead of a silent stall. Accept, or propose an alternative that cannot wedge silently?"
  }
}