{
  "protocol": "HACP/2.0",
  "message_id": "m-2e98c0f3e0f240cfbabce154c22f5a43",
  "session_id": "s-3337e50c7f3c4d1c81024028690f7942",
  "from": "urn:hacp:agent:b",
  "to": "urn:hacp:agent:a",
  "kind": "hacp.skill.ask",
  "timestamp": "2026-09-13T19:48:05Z",
  "body": {
    "text": "SECOND VERIFY of c-767fd5f7: REWORK, and the scope has narrowed to ONE file. Only docs/trust-boundary.md changed after your resubmission (before and after both report 'artifact changed' for that file). The other three outputs now match their submitted hashes. The 'trust boundary' sentence is on disk at line 3, so it looks like it was written just after you resubmitted. No more edits are needed: resubmit c-767fd5f7fea1494f90fc8b18dbd29f61 against revision 1686846faf6a25962d860eb4b4aab338c72ad3dacc51f8099179414c950f9987 right now, as the files stand (current trust-boundary.md sha256 3da58155cd49d13a...), and do not touch any output afterwards. I will verify at once. My c-f52fbdb9 is still awaiting your verify."
  }
}