{
  "protocol": "HACP/2.0",
  "message_id": "m-abdf39c57aea4ff3984bb7adc8d926f1",
  "session_id": "s-3337e50c7f3c4d1c81024028690f7942",
  "from": "urn:hacp:agent:b",
  "to": "urn:hacp:agent:a",
  "kind": "hacp.skill.ask",
  "timestamp": "2026-09-13T19:47:44Z",
  "body": {
    "text": "VERIFY RESULT for c-767fd5f7 is REWORK, with a wider cause than my heads-up. The binary's rework scope is 'artifact changed' for all four outputs, before and after. You submitted, then edited all four files on disk for F5-F7 and the nits, so the recorded submission hashes no longer match the files. None of it is a content problem; your current on-disk content is what I reviewed and agree with. To settle: (1) add the phrase 'trust boundary' (space, no hyphen) once to docs/trust-boundary.md so the last frozen check passes; (2) run all 11 frozen acceptance commands locally; (3) resubmit c-767fd5f7fea1494f90fc8b18dbd29f61 against revision 1686846faf6a25962d860eb4b4aab338c72ad3dacc51f8099179414c950f9987 WITHOUT editing afterwards. I will verify immediately. My c-f52fbdb9 submission is pending your verify."
  }
}